<?xml version="1.0" encoding="UTF-8"?>
<eshop xmlns="https://petrhovorka.com/smartelefon"
    xmlns:xsi="http://www.w3.org/2001/XMLSchema-instance"
    xsi:schemaLocation="https://petrhovorka.com/smartelefon eshop.xsd">
    <polozky>
        <polozka>
            <vyrobce>Samsung</vyrobce>
            <model>Galaxy J5 Duos</model>
            <produktoveCislo>SM-J530FZKDETL</produktoveCislo>
            <cena typ="aktualni" mena="CZK">4790</cena>
            <cena typ="puvodni" mena="CZK">6690</cena>
            <cena typ="puvodni" mena="EUR">280</cena>
            <cena typ="aktualni" mena="EUR">200</cena>
            <dostupnost>
                <sklad mesto="Praha">0</sklad>
                <sklad mesto="Brno">0</sklad>
                <sklad mesto="Ostrava">0</sklad>
            </dostupnost>
            <obrazek>samsungJ5Duos.jpg</obrazek>
            <popis>Kromě svých vynikajících technických parametrů a množství praktických funkcí vás
                chytrý telefon Galaxy J5 od společnosti Samsung nadchne i stylovým designem. Jeho
                kovové provedení vás okouzlí na první pohled, zároveň oceníte jeho ergonomickou a
                pevnou konstrukci. A na 5,2palcovém Super AMOLED displeji s HD rozlišením, který
                chrání tvrzené 2.5D sklo, si vychutnáte veškerý multimediální obsah ve vysoké
                kvalitě.</popis>
            <parametry>
                <system>
                    <nazev>Android</nazev>
                    <verze>7.1</verze>
                </system>
                <ram jednotka="GB">2</ram>
                <interniUloziste jednotka="GB">16</interniUloziste>
                <externiUloziste>MicroSDXC</externiUloziste>
                <cpu>
                    <nazev>Exynos 7870 Octa Core 64bit</nazev>
                    <pocetJader>8</pocetJader>
                    <frekvence jednotka="GHz">1.6</frekvence>
                </cpu>
                <fotoaparat typ="zadni">
                    <rozliseni>13MPx</rozliseni>
                    <svetelnost>F/1.9</svetelnost>
                    <blesk>ano</blesk>
                    <stabilizace>ne</stabilizace>
                </fotoaparat>
                <fotoaparat typ="predni">
                    <rozliseni>13MPx</rozliseni>
                    <svetelnost>F/1.9</svetelnost>
                </fotoaparat>
                <displej>
                    <velikost jednotka="&quot;">5.2</velikost>
                    <rozliseni>1280x720</rozliseni>
                </displej>
                <baterie>
                    <kapacita jednotka="mAh">3000</kapacita>
                </baterie>
                <sim typ="nano">
                    <pocet>2</pocet>
                </sim>
                <konektivita>
                    <wifi>ano</wifi>
                    <lte>ano</lte>
                    <bluetooth>ano</bluetooth>
                    <nfc>ano</nfc>
                </konektivita>
                <barvy>
                    <barva>Černá</barva>
                    <barva>Zlatá</barva>
                    <barva>Modrá</barva>
                </barvy>
                <rozmery jednotka="mm">
                    <s>71.3</s>
                    <v>146.3</v>
                    <h>7.9</h>
                </rozmery>
                <obsahBaleni>
                    <polozka>Napájecí adaptér</polozka>
                    <polozka>USB kabel</polozka>
                    <polozka>Sluchátka</polozka>
                </obsahBaleni>
            </parametry>
        </polozka>
        <polozka>
            <vyrobce>Apple</vyrobce>
            <model>iPhone SE 32GB</model>
            <produktoveCislo>MP822CS/A</produktoveCislo>
            <cena typ="aktualni" mena="CZK">7777</cena>
            <cena typ="puvodni" mena="CZK">12999</cena>
            <cena typ="aktualni" mena="EUR">300</cena>
            <cena typ="puvodni" mena="EUR">510</cena>
            <dostupnost>
                <sklad mesto="Praha">12</sklad>
                <sklad mesto="Brno">9</sklad>
                <sklad mesto="Ostrava">4</sklad>
            </dostupnost>
            <obrazek>iPhoneSE.jpg</obrazek>
            <popis>Návrat oblíbeného designu se 4" úhlopříčkou.
                Společnost Apple opět útočí na základní smysly mnoha miliónů uživatelů po celém světě. Nový iPhone SE je totiž ideální volba pro všechny zákazníky, kteří milují malé telefony pro jejich kompaktnost a snadné ovládání jednou rukou. V oblíbeném designu tak najdete ten vůbec nejvýkonnější 4palcový telefon na světě.
            </popis>
            <parametry>
                <system>
                    <nazev>iOS</nazev>
                    <verze>11.3.1</verze>
                </system>
                <ram jednotka="GB">2</ram>
                <interniUloziste jednotka="GB">32</interniUloziste>
                <cpu>
                    <nazev>Apple A9</nazev>
                    <pocetJader>2</pocetJader>
                    <frekvence jednotka="GHz">1.84</frekvence>
                </cpu>
                <fotoaparat typ="zadni">
                    <rozliseni>12Mpx</rozliseni>
                    <svetelnost>f/2,2</svetelnost>
                    <blesk>ano</blesk>
                    <stabilizace>ne</stabilizace>
                </fotoaparat>
                <fotoaparat typ="predni">
                    <rozliseni>1,2Mpx</rozliseni>
                </fotoaparat>
                <displej>
                    <velikost jednotka="&quot;">4</velikost>
                    <rozliseni>1136x640</rozliseni>
                </displej>
                <baterie>
                    <kapacita jednotka="mAh">1624</kapacita>
                </baterie>
                <sim typ="nano">
                    <pocet>1</pocet>
                </sim>
                <konektivita>
                    <wifi>ano</wifi>
                    <lte>ano</lte>
                    <bluetooth>ano</bluetooth>
                    <nfc>ano</nfc>
                </konektivita>
                <barvy>
                    <barva>Stříbrná</barva>
                    <barva>Zlatá</barva>
                    <barva>Vesmírně šedá</barva>
                    <barva>Růžově zlatá</barva>
                </barvy>
                <rozmery jednotka="mm">
                    <s>58.6</s>
                    <v>123.8</v>
                    <h>7.6</h>
                </rozmery>
                <obsahBaleni>
                    <polozka>Manuál</polozka>
                    <polozka>USB kabel</polozka>
                    <polozka>napájecí adaptér</polozka>
                    <polozka>sluchátka</polozka>
                </obsahBaleni>
            </parametry>
        </polozka>
        <polozka>
            <vyrobce>Apple</vyrobce>
            <model>iPhone X 64GB</model>
            <produktoveCislo>MQAD2CN/A</produktoveCislo>
            <cena typ="aktualni" mena="CZK">29890</cena>
            <cena typ="puvodni" mena="CZK">29990</cena>
            <cena typ="aktualni" mena="EUR">1175</cena>
            <cena typ="puvodni" mena="EUR">1180</cena>
            <dostupnost>
                <sklad mesto="Praha">6</sklad>
                <sklad mesto="Brno">8</sklad>
                <sklad mesto="Ostrava">1</sklad>
            </dostupnost>
            <obrazek>iPhoneX.jpg</obrazek>
            <video>https://youtu.be/mW6hFttt_KE</video>
            <popis>
                iPhone jsme si vždycky představovali jako zařízení, které je vlastně jen obrazovka. Které ustoupí tomu, co na něm zrovna děláš. A které je tak inteligentní, že reaguje na dotyky, slova i pohledy. S iPhonem X jsme tuhle představu proměnili v realitu. Takhle vypadá budoucnost.
            </popis>
            <parametry>
                <system>
                    <nazev>iOS</nazev>
                    <verze>11.3.1</verze>
                </system>
                <ram jednotka="GB">3</ram>
                <interniUloziste jednotka="GB">64</interniUloziste>
                <cpu>
                    <nazev>Apple A11 Bionic Hexa Core 64bit</nazev>
                    <pocetJader>6</pocetJader>
                    <frekvence jednotka="GHz">2.5</frekvence>
                </cpu>
                <fotoaparat typ="zadni">
                    <rozliseni>12Mpx</rozliseni>
                    <svetelnost>f/1,8</svetelnost>
                    <blesk>ano</blesk>
                    <stabilizace>ano</stabilizace>
                </fotoaparat>
                <fotoaparat typ="predni">
                    <rozliseni>7Mpx</rozliseni>
                </fotoaparat>
                <displej>
                    <velikost jednotka="&quot;">5.8</velikost>
                    <rozliseni>2436x1125</rozliseni>
                </displej>
                <baterie>
                    <kapacita jednotka="mAh">2716</kapacita>
                </baterie>
                <sim typ="nano">
                    <pocet>1</pocet>
                </sim>
                <konektivita>
                    <wifi>ano</wifi>
                    <lte>ano</lte>
                    <bluetooth>ano</bluetooth>
                    <nfc>ano</nfc>
                </konektivita>
                <barvy>
                    <barva>Stříbrná</barva>
                    <barva>Vesmírně šedá</barva>
                </barvy>
                <rozmery jednotka="mm">
                    <s>70.9</s>
                    <v>143.6</v>
                    <h>7.7</h>
                </rozmery>
                <obsahBaleni>
                    <polozka>Manuál</polozka>
                    <polozka>USB kabel</polozka>
                    <polozka>napájecí adaptér</polozka>
                    <polozka>sluchátka</polozka>
                </obsahBaleni>
            </parametry>
        </polozka>
        <polozka>
            <vyrobce>Apple</vyrobce>
            <model>iPhone 8 64GB</model>
            <produktoveCislo>MQ6G2CN/A</produktoveCislo>
            <cena typ="aktualni" mena="CZK">20990</cena>